{
  "tool": "classify",
  "purpose": "classify:catalyst:43",
  "input_hash": "sha256:5d74f1f732e24e1598998ba4afb700dd1326de690cd4d728be4b914b5742f28d",
  "input_len": 471,
  "status": "review",
  "confidence": 0.69,
  "cached": false,
  "result": {
    "label": "확정",
    "prob": 0.69,
    "decision": "review",
    "distribution": {
      "확정": 0.69
    }
  },
  "raw": {
    "tool": "jev_classify",
    "model": "jev-1.13.0",
    "results": [
      {
        "id": "catalyst:43",
        "classification": "확정",
        "probabilities": {
          "확정": 0.69
        },
        "top_probability": 0.69,
        "confidence": 0.69,
        "decision": "review"
      }
    ],
    "synth": {
      "label": "합성",
      "basis": "보고서 #64·#111 같은 이름 항목"
    }
  },
  "duration_ms": null,
  "judgment_seq": null,
  "created_at": "2026-10-09T06:00:00+09:00",
  "adapter_version": "mock-fixture-2026-10-08",
  "snapshot_id": 12,
  "complex_id": null,
  "error_text": null
}
