{
  "tool": "screen",
  "purpose": "screen:notice:11",
  "input_hash": "sha256:69ae35cb9841724201d5b0d8fc31fcba08c20a43578d350c77a69938adcbc133",
  "input_len": 54,
  "status": "ok",
  "confidence": null,
  "cached": false,
  "result": {
    "verdict": "pass",
    "injection": null,
    "substance": null,
    "relevance": 0.98
  },
  "raw": {
    "thresholds": {
      "block": 0.75,
      "review": 0.25
    }
  },
  "duration_ms": null,
  "judgment_seq": 92,
  "created_at": "2026-10-07",
  "adapter_version": "mock-fixture-2026-10-08",
  "snapshot_id": 12,
  "complex_id": 11,
  "error_text": null
}
