{
  "tool": "extract",
  "purpose": "extract:rd9054:0",
  "input_hash": "sha256:b2c7cb93bbdc49a1d9259ca831112ccdbe5bba17315e9e68ef3c524718c15ede",
  "input_len": 657,
  "status": "ok",
  "confidence": 0.9,
  "cached": false,
  "result": {
    "fields": [
      {
        "name": "resale_months",
        "value_text": null,
        "decision": "auto",
        "confidence": 0.9,
        "excerpt": null
      },
      {
        "name": "residency_months",
        "value_text": null,
        "decision": "auto",
        "confidence": 0.9,
        "excerpt": null
      },
      {
        "name": "move_in_ym",
        "value_text": null,
        "decision": "auto",
        "confidence": 0.9,
        "excerpt": null
      }
    ]
  },
  "raw": {
    "tool": "jev_extract",
    "model": "jev-1.13.0",
    "results": [
      {
        "id": "resale_months",
        "value": null,
        "status": "not_found",
        "confidence": 0.9
      },
      {
        "id": "residency_months",
        "value": null,
        "status": "not_found",
        "confidence": 0.9
      },
      {
        "id": "move_in_ym",
        "value": null,
        "status": "not_found",
        "confidence": 0.9
      }
    ],
    "synth": {
      "label": "합성",
      "basis": "SynthJev 기본(보고서에 필드별 대응 값 없음)"
    }
  },
  "duration_ms": null,
  "judgment_seq": null,
  "created_at": "2026-10-09T06:00:00+09:00",
  "adapter_version": "mock-fixture-2026-10-08",
  "snapshot_id": 12,
  "complex_id": 14,
  "error_text": null
}
