{
  "tool": "verify",
  "purpose": "verify:section_complex:8",
  "input_hash": "sha256:387157f27d52c3fdd535eaa4a1a64ce8d3b84a858d13d4b790396c9ac5529132",
  "input_len": 450,
  "status": "ok",
  "confidence": 0.95,
  "cached": false,
  "result": {
    "claims": [
      {
        "claim_id": "0",
        "verdict": "verified",
        "confidence": 0.95,
        "action": "auto"
      },
      {
        "claim_id": "1",
        "verdict": "verified",
        "confidence": 0.95,
        "action": "auto"
      },
      {
        "claim_id": "2",
        "verdict": "verified",
        "confidence": 0.95,
        "action": "auto"
      },
      {
        "claim_id": "3",
        "verdict": "verified",
        "confidence": 0.95,
        "action": "auto"
      },
      {
        "claim_id": "4",
        "verdict": "verified",
        "confidence": 0.95,
        "action": "auto"
      }
    ]
  },
  "raw": {
    "tool": "jev_verify",
    "model": "jev-1.13.0",
    "results": [
      {
        "id": "claim0",
        "claim": "풍무역세권 수자인 그라센트 2차 기준 타입 최고 공급금액은 711,500,000원이다",
        "verdict": "verified",
        "confidence": 0.95,
        "action": "auto"
      },
      {
        "id": "claim1",
        "claim": "풍무역세권 수자인 그라센트 2차 입주 예정 시기는 2029-01이다",
        "verdict": "verified",
        "confidence": 0.95,
        "action": "auto"
      },
      {
        "id": "claim2",
        "claim": "풍무역세권 수자인 그라센트 2차 전매제한 기간은 36개월이다",
        "verdict": "verified",
        "confidence": 0.95,
        "action": "auto"
      },
      {
        "id": "claim3",
        "claim": "풍무역세권 수자인 그라센트 2차 거주의무 기간은 0개월이다",
        "verdict": "verified",
        "confidence": 0.95,
        "action": "auto"
      },
      {
        "id": "claim4",
        "claim": "풍무역세권 수자인 그라센트 2차는 계약금 비율 10%를 적용한다",
        "verdict": "verified",
        "confidence": 0.95,
        "action": "auto"
      }
    ],
    "synth": {
      "label": "합성",
      "basis": "보고서 §8-5·§12-5-5 최종 verify = verified(문장 1:1 대응 없음)"
    }
  },
  "duration_ms": null,
  "judgment_seq": null,
  "created_at": "2026-10-09T06:00:00+09:00",
  "adapter_version": "mock-fixture-2026-10-08",
  "snapshot_id": 13,
  "complex_id": 8,
  "error_text": null
}
