{
  "tool": "noul",
  "purpose": "noul:ladder:move_in_plus_1y:2032-01:c9",
  "input_hash": "sha256:d28a29cec51d2d95a6e5c24f03a6008d43bda1853f279b29acfa0eb4e40b9a21",
  "input_len": 763,
  "status": "ok",
  "confidence": null,
  "cached": false,
  "result": {
    "horizon": "move_in_plus_1y",
    "target_ym": "2032-01",
    "propositions": [
      {
        "key": "p5",
        "text": "한강 푸르지오 리버프론트 전용 84A(84㎡)를 2026-10-08 현재 구매가(6.54~7.83억, 공급가+발코니)로 매수할 경우, 입주(2031-01) 후 1년 시점인 2032 상반기 실거래가가 현재 구매가 대비 +5% 이상이다",
        "prob": 0.35,
        "verdict": "uncertain",
        "decision": "review"
      },
      {
        "key": "p10",
        "text": "한강 푸르지오 리버프론트 전용 84A(84㎡)를 2026-10-08 현재 구매가(6.54~7.83억, 공급가+발코니)로 매수할 경우, 입주(2031-01) 후 1년 시점인 2032 상반기 실거래가가 현재 구매가 대비 +10% 이상이다",
        "prob": 0.28,
        "verdict": "uncertain",
        "decision": "review"
      },
      {
        "key": "p20",
        "text": "한강 푸르지오 리버프론트 전용 84A(84㎡)를 2026-10-08 현재 구매가(6.54~7.83억, 공급가+발코니)로 매수할 경우, 입주(2031-01) 후 1년 시점인 2032 상반기 실거래가가 현재 구매가 대비 +20% 이상이다",
        "prob": 0.18,
        "verdict": "uncertain",
        "decision": "review"
      },
      {
        "key": "p_flat",
        "text": "한강 푸르지오 리버프론트 전용 84A(84㎡)를 2026-10-08 현재 구매가(6.54~7.83억, 공급가+발코니)로 매수할 경우, 입주(2031-01) 후 1년 시점인 2032 상반기 실거래가가 현재 구매가 대비 이하(보합·하락)이다",
        "prob": 0.66,
        "verdict": "uncertain",
        "decision": "review"
      }
    ]
  },
  "raw": {
    "tool": "jev_noul",
    "model": "jev-1.13.0",
    "status": "ok",
    "results": [
      {
        "id": "proposition0",
        "proposition": "한강 푸르지오 리버프론트 전용 84A(84㎡)를 2026-10-08 현재 구매가(6.54~7.83억, 공급가+발코니)로 매수할 경우, 입주(2031-01) 후 1년 시점인 2032 상반기 실거래가가 현재 구매가 대비 +5% 이상이다",
        "probability": 0.35,
        "label": "uncertain",
        "auto": false
      },
      {
        "id": "proposition1",
        "proposition": "한강 푸르지오 리버프론트 전용 84A(84㎡)를 2026-10-08 현재 구매가(6.54~7.83억, 공급가+발코니)로 매수할 경우, 입주(2031-01) 후 1년 시점인 2032 상반기 실거래가가 현재 구매가 대비 +10% 이상이다",
        "probability": 0.28,
        "label": "uncertain",
        "auto": false
      },
      {
        "id": "proposition2",
        "proposition": "한강 푸르지오 리버프론트 전용 84A(84㎡)를 2026-10-08 현재 구매가(6.54~7.83억, 공급가+발코니)로 매수할 경우, 입주(2031-01) 후 1년 시점인 2032 상반기 실거래가가 현재 구매가 대비 +20% 이상이다",
        "probability": 0.18,
        "label": "uncertain",
        "auto": false
      },
      {
        "id": "proposition3",
        "proposition": "한강 푸르지오 리버프론트 전용 84A(84㎡)를 2026-10-08 현재 구매가(6.54~7.83억, 공급가+발코니)로 매수할 경우, 입주(2031-01) 후 1년 시점인 2032 상반기 실거래가가 현재 구매가 대비 이하(보합·하락)이다",
        "probability": 0.66,
        "label": "uncertain",
        "auto": false
      }
    ],
    "synth": {
      "label": "합성",
      "basis": "보고서 #119 noul(입주 후 1년)"
    }
  },
  "duration_ms": null,
  "judgment_seq": null,
  "created_at": "2026-10-09T06:00:00+09:00",
  "adapter_version": "mock-fixture-2026-10-08",
  "snapshot_id": 13,
  "complex_id": 9,
  "error_text": null
}
