{
  "tool": "classify",
  "purpose": "classify:catalyst:33",
  "input_hash": "sha256:395b9897f4e4cb6d0db0e4238eaebb0043ca9f20c106f3cdeb9b1f1b50a2a058",
  "input_len": 484,
  "status": "ok",
  "confidence": 0.97,
  "cached": false,
  "result": {
    "label": "계획",
    "prob": 0.97,
    "decision": "auto",
    "distribution": {
      "계획": 0.97
    }
  },
  "raw": {
    "tool": "jev_classify",
    "model": "jev-1.13.0",
    "results": [
      {
        "id": "catalyst:33",
        "classification": "계획",
        "probabilities": {
          "계획": 0.97
        },
        "top_probability": 0.97,
        "confidence": 0.97,
        "decision": "auto"
      }
    ],
    "synth": {
      "label": "합성",
      "basis": "보고서 #64·#111 같은 이름 항목"
    }
  },
  "duration_ms": null,
  "judgment_seq": null,
  "created_at": "2026-10-09T06:00:00+09:00",
  "adapter_version": "mock-fixture-2026-10-08",
  "snapshot_id": 12,
  "complex_id": null,
  "error_text": null
}
