{
  "tool": "verify",
  "purpose": "verify:section_complex:12",
  "input_hash": "sha256:430c5dbdd2620ff10de080e19a469575b56f65a802e2a4df86cdb3df5a1af78c",
  "input_len": 429,
  "status": "ok",
  "confidence": 0.95,
  "cached": false,
  "result": {
    "claims": [
      {
        "claim_id": "0",
        "verdict": "verified",
        "confidence": 0.95,
        "action": "auto"
      },
      {
        "claim_id": "1",
        "verdict": "verified",
        "confidence": 0.95,
        "action": "auto"
      },
      {
        "claim_id": "2",
        "verdict": "verified",
        "confidence": 0.95,
        "action": "auto"
      },
      {
        "claim_id": "3",
        "verdict": "verified",
        "confidence": 0.95,
        "action": "auto"
      },
      {
        "claim_id": "4",
        "verdict": "verified",
        "confidence": 0.95,
        "action": "auto"
      }
    ]
  },
  "raw": {
    "tool": "jev_verify",
    "model": "jev-1.13.0",
    "results": [
      {
        "id": "claim0",
        "claim": "더샵 송도마리나베이 기준 타입 최고 공급금액은 784,000,000원이다",
        "verdict": "verified",
        "confidence": 0.95,
        "action": "auto"
      },
      {
        "id": "claim1",
        "claim": "더샵 송도마리나베이 입주 예정 시기는 2020-07이다",
        "verdict": "verified",
        "confidence": 0.95,
        "action": "auto"
      },
      {
        "id": "claim2",
        "claim": "더샵 송도마리나베이 전매제한 기간은 0개월이다",
        "verdict": "verified",
        "confidence": 0.95,
        "action": "auto"
      },
      {
        "id": "claim3",
        "claim": "더샵 송도마리나베이 거주의무 기간은 0개월이다",
        "verdict": "verified",
        "confidence": 0.95,
        "action": "auto"
      },
      {
        "id": "claim4",
        "claim": "더샵 송도마리나베이는 계약금 비율 10%를 적용한다",
        "verdict": "verified",
        "confidence": 0.95,
        "action": "auto"
      }
    ],
    "synth": {
      "label": "합성",
      "basis": "보고서 §8-5·§12-5-5 최종 verify = verified(문장 1:1 대응 없음)"
    }
  },
  "duration_ms": null,
  "judgment_seq": null,
  "created_at": "2026-10-09T06:00:00+09:00",
  "adapter_version": "mock-fixture-2026-10-08",
  "snapshot_id": 13,
  "complex_id": 12,
  "error_text": null
}
