{
  "tool": "extract",
  "purpose": "extract:notice:10",
  "input_hash": "sha256:d4b97412458bc62cd4d87e5f9301f61044072c9619dae59b13169a5ef0a8e66c",
  "input_len": 66,
  "status": "ok",
  "confidence": null,
  "cached": false,
  "result": {
    "fields": [],
    "counts": {
      "auto": 12,
      "review": 0,
      "total": 12
    }
  },
  "raw": {
    "thresholds": {
      "auto_accept": 0.85,
      "margin": 0.5
    },
    "note": "보고서는 review 필드 이름 일부만 기재 — fields에는 기재된 것만, 나머지는 counts"
  },
  "duration_ms": null,
  "judgment_seq": 101,
  "created_at": "2026-10-07",
  "adapter_version": "mock-fixture-2026-10-08",
  "snapshot_id": 12,
  "complex_id": 10,
  "error_text": null
}
