{
  "tool": "classify",
  "purpose": "classify:catalyst:38",
  "input_hash": "sha256:fc4ca4a7a3f95b6864e2456d74186933d4965c337fdcca06517ea89a8bb65aae",
  "input_len": 635,
  "status": "ok",
  "confidence": 1.0,
  "cached": false,
  "result": {
    "label": "미확정",
    "prob": 1.0,
    "decision": "auto",
    "distribution": {
      "미확정": 1.0
    }
  },
  "raw": {
    "tool": "jev_classify",
    "model": "jev-1.13.0",
    "results": [
      {
        "id": "catalyst:38",
        "classification": "미확정",
        "probabilities": {
          "미확정": 1.0
        },
        "top_probability": 1.0,
        "confidence": 1.0,
        "decision": "auto"
      }
    ],
    "synth": {
      "label": "합성",
      "basis": "보고서 #64·#111 같은 이름 항목"
    }
  },
  "duration_ms": null,
  "judgment_seq": null,
  "created_at": "2026-10-09T06:00:00+09:00",
  "adapter_version": "mock-fixture-2026-10-08",
  "snapshot_id": 12,
  "complex_id": null,
  "error_text": null
}
