{
  "tool": "decide",
  "purpose": "decide:scenario_B",
  "input_hash": "sha256:839e5a0be73b52df40ba45e812cdf30253aa41dfb98dd96b8e927316eef3374f",
  "input_len": 163,
  "status": "ok",
  "confidence": 0.48,
  "cached": false,
  "result": {
    "selected": "complex:7",
    "probs": {
      "complex:7": 0.54,
      "complex:2": 0.42,
      "complex:3": 0.01,
      "complex:4": 0.01,
      "complex:1": 0.0,
      "wait_new": 0.0
    },
    "checks": {
      "complex:1": {
        "access": "contradicted",
        "regulation": "supported",
        "funds": "contradicted"
      },
      "complex:2": {
        "access": "supported",
        "regulation": "supported",
        "funds": "supported"
      },
      "complex:3": {
        "access": "supported",
        "regulation": "supported",
        "funds": "contradicted"
      },
      "complex:4": {
        "access": "unknown",
        "regulation": "supported",
        "funds": "contradicted"
      },
      "complex:7": {
        "access": "supported",
        "regulation": "supported",
        "funds": "supported"
      },
      "wait_new": {
        "access": "contradicted",
        "regulation": "unknown",
        "funds": "unknown"
      }
    },
    "warnings": [],
    "escaped": false,
    "question": null
  },
  "raw": {
    "requirement_order": [
      "access",
      "funds",
      "regulation"
    ],
    "source": "expected_scores.json decide_integrated.B"
  },
  "duration_ms": null,
  "judgment_seq": 127,
  "created_at": "2026-10-07",
  "adapter_version": "mock-fixture-2026-10-08",
  "snapshot_id": 12,
  "complex_id": null,
  "error_text": null
}
