{
  "tool": "decide",
  "purpose": "decide:scenario_D",
  "input_hash": "sha256:a2d6a7b957d2ed259ff867f1df41ba899f6f9b0b8b019de40c041c968629c1de",
  "input_len": 1974,
  "status": "ok",
  "confidence": 0.92,
  "cached": false,
  "result": {
    "selected": "complex:2",
    "probs": {
      "complex:2": 0.93,
      "complex:3": 0.01,
      "complex:7": 0.05
    },
    "checks": {
      "complex:2": {
        "access": "supported",
        "regulation": "supported",
        "funds": "supported"
      },
      "complex:3": {
        "access": "supported",
        "regulation": "supported",
        "funds": "supported"
      },
      "complex:7": {
        "access": "supported",
        "regulation": "supported",
        "funds": "supported"
      }
    },
    "warnings": [],
    "escaped": false,
    "question": null
  },
  "raw": {
    "tool": "jev_decide",
    "model": "jev-1.13.0",
    "recommendation": {
      "selected": "complex_2",
      "escaped": false,
      "confidence": 0.92,
      "probabilities": {
        "complex_2": 0.93,
        "complex_3": 0.01,
        "complex_7": 0.05
      }
    },
    "checks": [
      {
        "candidate": "complex_2",
        "requirement": 0,
        "answer": "supported"
      },
      {
        "candidate": "complex_2",
        "requirement": 1,
        "answer": "supported"
      },
      {
        "candidate": "complex_2",
        "requirement": 2,
        "answer": "supported"
      },
      {
        "candidate": "complex_3",
        "requirement": 0,
        "answer": "supported"
      },
      {
        "candidate": "complex_3",
        "requirement": 1,
        "answer": "supported"
      },
      {
        "candidate": "complex_3",
        "requirement": 2,
        "answer": "supported"
      },
      {
        "candidate": "complex_7",
        "requirement": 0,
        "answer": "supported"
      },
      {
        "candidate": "complex_7",
        "requirement": 1,
        "answer": "supported"
      },
      {
        "candidate": "complex_7",
        "requirement": 2,
        "answer": "supported"
      }
    ],
    "warnings": [],
    "synth": {
      "label": "합성",
      "basis": "보고서 #129 decide(선택·확률·확신도 그대로)"
    }
  },
  "duration_ms": null,
  "judgment_seq": null,
  "created_at": "2026-10-09T06:00:00+09:00",
  "adapter_version": "mock-fixture-2026-10-08",
  "snapshot_id": 13,
  "complex_id": null,
  "error_text": null
}
