{
  "tool": "audit",
  "purpose": "audit:notice:5",
  "input_hash": "sha256:eeee56963e2e9d4a99bdebc23abed60c8f2badd722099e0e3cc152e6b7fe6af5",
  "input_len": 60,
  "status": "ok",
  "confidence": null,
  "cached": false,
  "result": {
    "verdict": "pass",
    "items": [],
    "counts": {
      "records": 15,
      "flagged": 0
    }
  },
  "raw": {
    "thresholds": {
      "wrong_at": 0.7
    },
    "decision": "pass"
  },
  "duration_ms": null,
  "judgment_seq": 56,
  "created_at": "2026-10-07",
  "adapter_version": "mock-fixture-2026-10-08",
  "snapshot_id": 11,
  "complex_id": 5,
  "error_text": null
}
