{
  "tool": "classify",
  "purpose": "classify:catalyst_kind:18",
  "input_hash": "sha256:9c05441e0f3741eb038b0f9605b2612cebcf815ff983847f7d8dd4ec2f5e4ce7",
  "input_len": 495,
  "status": "review",
  "confidence": 0.55,
  "cached": false,
  "result": {
    "label": "미확정",
    "prob": 0.55,
    "decision": "review",
    "distribution": {
      "미확정": 0.55
    }
  },
  "raw": {
    "tool": "jev_classify",
    "model": "jev-1.13.0",
    "results": [
      {
        "id": "catalyst:18",
        "classification": "미확정",
        "probabilities": {
          "미확정": 0.55
        },
        "top_probability": 0.55,
        "confidence": 0.55,
        "decision": "review"
      }
    ],
    "synth": {
      "label": "합성",
      "basis": "보고서 #64·#111 같은 이름 항목"
    }
  },
  "duration_ms": null,
  "judgment_seq": null,
  "created_at": "2026-10-09T06:00:00+09:00",
  "adapter_version": "mock-fixture-2026-10-08",
  "snapshot_id": 13,
  "complex_id": null,
  "error_text": null
}
